timestamp,name,name_visible,terms,upload,label,description,_date,location,location_slug,license,free_location,lat,lon,pid,order,layout,collection,thumbnail,full,manifest
2020-04-16 18:00:55 -0600,Sarah,Yes,Yes,https://drive.google.com/open?id=1y74fx6tnk-z_pYcdPa5nLM0tuHbwDGjN,Quarantine craft projects,"",4/10/2020,"Bonnie Doon, Edmonton",bonnie-doon-edmonton,,Bonnie Doon,53.525336550000006,-113.4670455898752,1y74fx6tnk-z_pYcdPa5nLM0tuHbwDGjN,1,community_archive_item,community_archive,"/img/derivatives/iiif/images/1y74fx6tnk-z_pYcdPa5nLM0tuHbwDGjN/full/250,/0/default.jpg",/img/derivatives/iiif/images/1y74fx6tnk-z_pYcdPa5nLM0tuHbwDGjN/full/full/0/default.jpg,/img/derivatives/iiif/1y74fx6tnk-z_pYcdPa5nLM0tuHbwDGjN/manifest.json
2020-04-08 15:40:53 -0600,Sarah Severson ,"Yes, but just my first name",Yes,https://drive.google.com/open?id=1RcOwpu9czNtDyVRsYtlVKVrM1zh58dN_,Closed playground,Walked by the playground in the Rutherford School playground today. It’s sad to see it all wrapped up in caution tape and with the closed sign. ,4/6/2020,"Bonnie Doon, Edmonton",bonnie-doon-edmonton,,Bonnie Doon,53.525336550000006,-113.4670455898752,1RcOwpu9czNtDyVRsYtlVKVrM1zh58dN_,3,community_archive_item,community_archive,"/img/derivatives/iiif/images/1RcOwpu9czNtDyVRsYtlVKVrM1zh58dN_/full/250,/0/default.jpg",/img/derivatives/iiif/images/1RcOwpu9czNtDyVRsYtlVKVrM1zh58dN_/full/full/0/default.jpg,/img/derivatives/iiif/1RcOwpu9czNtDyVRsYtlVKVrM1zh58dN_/manifest.json
2020-04-24 11:43:26 -0600,Peter Binkley,Yes,Yes,https://drive.google.com/open?id=1AXdY0Yky9-QlpUrfNarhw8buU03m-aMt,Rainbow in the Deli Counter,"In the Safeway in Millbourne Mall, the deli counter closed weeks ago, and has now been filled with a rainbow of balloons.",4/21/2020,"Millbourne, Mill Woods, Edmonton",millbourne-mill-woods-edmonton,,"Millbourne Mall, Mill Woods, Edmonton",53.4747562,-113.4516548,1AXdY0Yky9-QlpUrfNarhw8buU03m-aMt,0,community_archive_item,community_archive,"/img/derivatives/iiif/images/1AXdY0Yky9-QlpUrfNarhw8buU03m-aMt/full/250,/0/default.jpg",/img/derivatives/iiif/images/1AXdY0Yky9-QlpUrfNarhw8buU03m-aMt/full/full/0/default.jpg,/img/derivatives/iiif/1AXdY0Yky9-QlpUrfNarhw8buU03m-aMt/manifest.json
2020-04-08 15:36:58 -0600,Sarah,Yes,Yes,https://drive.google.com/open?id=1nvqh5yod4JUUaZQxZhX9vGY-9DCXgYvB,Marquee of the Garneau Theatre saying it’s closed,going to the Garneau Theatre (or metro cinema) was one of my favourite activities but it’s been closed now since March 17 when Alberta Health started restricting mass gatherings. I drive by this sign a couple times a week and I appreciate how at the bottom they included “Take care of each other”.,4/5/2020,"Garneau, Strathcona, Edmonton",garneau-strathcona-edmonton,,Garneau,53.5196428,-113.5142523,1nvqh5yod4JUUaZQxZhX9vGY-9DCXgYvB,4,community_archive_item,community_archive,"/img/derivatives/iiif/images/1nvqh5yod4JUUaZQxZhX9vGY-9DCXgYvB/full/250,/0/default.jpg",/img/derivatives/iiif/images/1nvqh5yod4JUUaZQxZhX9vGY-9DCXgYvB/full/full/0/default.jpg,/img/derivatives/iiif/1nvqh5yod4JUUaZQxZhX9vGY-9DCXgYvB/manifest.json
2020-04-08 18:44:12 -0600,Sarah Severson ,"No, I'd like to contribute anonymously.",Yes,https://drive.google.com/open?id=19Y6JNH_Zhckqs2XdVgXe0v8z3UwSxmN0,Mia the snow woman in the front yard,"I took this photo on walk the other day while on a walk to the Mill Creek Ravine. I posted the photo to Instagram with no caption just because the idea of such a large formless snow sculpture made me smile and imagined this had been a fun project for a group of children. A day later, someone I didn’t know replied to the photo and let me know this was Mia the snow woman. ",4/6/2020,"Bonnie Doon, Edmonton",bonnie-doon-edmonton,,Bonnie Doon,53.525336550000006,-113.4670455898752,19Y6JNH_Zhckqs2XdVgXe0v8z3UwSxmN0,2,community_archive_item,community_archive,"/img/derivatives/iiif/images/19Y6JNH_Zhckqs2XdVgXe0v8z3UwSxmN0/full/250,/0/default.jpg",/img/derivatives/iiif/images/19Y6JNH_Zhckqs2XdVgXe0v8z3UwSxmN0/full/full/0/default.jpg,/img/derivatives/iiif/19Y6JNH_Zhckqs2XdVgXe0v8z3UwSxmN0/manifest.json
